[
  {
    "count": 0,
    "detail_schema_key": "activity.build_run",
    "family": "activity",
    "icon_key": "activity",
    "id": "activity.build_run",
    "label": "Build run",
    "populated": false,
    "resource_type": "activity.build_run",
    "table_name": "resource_activity_build_run"
  },
  {
    "count": 0,
    "detail_schema_key": "activity.deployment_run",
    "family": "activity",
    "icon_key": "activity",
    "id": "activity.deployment_run",
    "label": "Deployment run",
    "populated": false,
    "resource_type": "activity.deployment_run",
    "table_name": "resource_activity_deployment_run"
  },
  {
    "count": 0,
    "detail_schema_key": "activity.publication_run",
    "family": "activity",
    "icon_key": "activity",
    "id": "activity.publication_run",
    "label": "Publication run",
    "populated": false,
    "resource_type": "activity.publication_run",
    "table_name": "resource_activity_publication_run"
  },
  {
    "count": 0,
    "detail_schema_key": "activity.test_run",
    "family": "activity",
    "icon_key": "activity",
    "id": "activity.test_run",
    "label": "Test run",
    "populated": false,
    "resource_type": "activity.test_run",
    "table_name": "resource_activity_test_run"
  },
  {
    "count": 0,
    "detail_schema_key": "activity.workflow_run",
    "family": "activity",
    "icon_key": "activity",
    "id": "activity.workflow_run",
    "label": "Workflow run",
    "populated": false,
    "resource_type": "activity.workflow_run",
    "table_name": "resource_activity_workflow_run"
  },
  {
    "count": 0,
    "detail_schema_key": "artifact.attestation",
    "family": "artifact",
    "icon_key": "file-check-2",
    "id": "artifact.attestation",
    "label": "Attestation",
    "populated": false,
    "resource_type": "artifact.attestation",
    "table_name": "resource_artifact_attestation"
  },
  {
    "count": 0,
    "detail_schema_key": "artifact.audit_report",
    "family": "artifact",
    "icon_key": "file-check-2",
    "id": "artifact.audit_report",
    "label": "Audit report",
    "populated": false,
    "resource_type": "artifact.audit_report",
    "table_name": "resource_artifact_audit_report"
  },
  {
    "count": 0,
    "detail_schema_key": "artifact.benchmark_report",
    "family": "artifact",
    "icon_key": "file-check-2",
    "id": "artifact.benchmark_report",
    "label": "Benchmark report",
    "populated": false,
    "resource_type": "artifact.benchmark_report",
    "table_name": "resource_artifact_benchmark_report"
  },
  {
    "count": 0,
    "detail_schema_key": "artifact.build",
    "family": "artifact",
    "icon_key": "file-check-2",
    "id": "artifact.build",
    "label": "Build artifact",
    "populated": false,
    "resource_type": "artifact.build",
    "table_name": "resource_artifact_build"
  },
  {
    "count": 0,
    "detail_schema_key": "artifact.coverage_report",
    "family": "artifact",
    "icon_key": "file-check-2",
    "id": "artifact.coverage_report",
    "label": "Coverage report",
    "populated": false,
    "resource_type": "artifact.coverage_report",
    "table_name": "resource_artifact_coverage_report"
  },
  {
    "count": 0,
    "detail_schema_key": "artifact.generated_document",
    "family": "artifact",
    "icon_key": "file-check-2",
    "id": "artifact.generated_document",
    "label": "Generated document",
    "populated": false,
    "resource_type": "artifact.generated_document",
    "table_name": "resource_artifact_generated_document"
  },
  {
    "count": 0,
    "detail_schema_key": "artifact.provenance_statement",
    "family": "artifact",
    "icon_key": "file-check-2",
    "id": "artifact.provenance_statement",
    "label": "Provenance statement",
    "populated": false,
    "resource_type": "artifact.provenance_statement",
    "table_name": "resource_artifact_provenance_statement"
  },
  {
    "count": 0,
    "detail_schema_key": "artifact.publication_record",
    "family": "artifact",
    "icon_key": "file-check-2",
    "id": "artifact.publication_record",
    "label": "Publication record",
    "populated": false,
    "resource_type": "artifact.publication_record",
    "table_name": "resource_artifact_publication_record"
  },
  {
    "count": 0,
    "detail_schema_key": "artifact.security_report",
    "family": "artifact",
    "icon_key": "file-check-2",
    "id": "artifact.security_report",
    "label": "Security report",
    "populated": false,
    "resource_type": "artifact.security_report",
    "table_name": "resource_artifact_security_report"
  },
  {
    "count": 0,
    "detail_schema_key": "artifact.test_report",
    "family": "artifact",
    "icon_key": "file-check-2",
    "id": "artifact.test_report",
    "label": "Test report",
    "populated": false,
    "resource_type": "artifact.test_report",
    "table_name": "resource_artifact_test_report"
  },
  {
    "count": 0,
    "detail_schema_key": "asset.archive",
    "family": "asset",
    "icon_key": "image",
    "id": "asset.archive",
    "label": "Asset archive",
    "populated": false,
    "resource_type": "asset.archive",
    "table_name": "resource_asset_archive"
  },
  {
    "count": 0,
    "detail_schema_key": "asset.audio",
    "family": "asset",
    "icon_key": "image",
    "id": "asset.audio",
    "label": "Audio asset",
    "populated": false,
    "resource_type": "asset.audio",
    "table_name": "resource_asset_audio"
  },
  {
    "count": 0,
    "detail_schema_key": "asset.diagram",
    "family": "asset",
    "icon_key": "image",
    "id": "asset.diagram",
    "label": "Diagram",
    "populated": false,
    "resource_type": "asset.diagram",
    "table_name": "resource_asset_diagram"
  },
  {
    "count": 0,
    "detail_schema_key": "asset.document",
    "family": "asset",
    "icon_key": "image",
    "id": "asset.document",
    "label": "Document asset",
    "populated": false,
    "resource_type": "asset.document",
    "table_name": "resource_asset_document"
  },
  {
    "count": 0,
    "detail_schema_key": "asset.font",
    "family": "asset",
    "icon_key": "image",
    "id": "asset.font",
    "label": "Font",
    "populated": false,
    "resource_type": "asset.font",
    "table_name": "resource_asset_font"
  },
  {
    "count": 0,
    "detail_schema_key": "asset.icon",
    "family": "asset",
    "icon_key": "image",
    "id": "asset.icon",
    "label": "Icon",
    "populated": false,
    "resource_type": "asset.icon",
    "table_name": "resource_asset_icon"
  },
  {
    "count": 0,
    "detail_schema_key": "asset.image",
    "family": "asset",
    "icon_key": "image",
    "id": "asset.image",
    "label": "Image",
    "populated": false,
    "resource_type": "asset.image",
    "table_name": "resource_asset_image"
  },
  {
    "count": 0,
    "detail_schema_key": "asset.logo",
    "family": "asset",
    "icon_key": "image",
    "id": "asset.logo",
    "label": "Logo",
    "populated": false,
    "resource_type": "asset.logo",
    "table_name": "resource_asset_logo"
  },
  {
    "count": 0,
    "detail_schema_key": "asset.screenshot",
    "family": "asset",
    "icon_key": "image",
    "id": "asset.screenshot",
    "label": "Screenshot",
    "populated": false,
    "resource_type": "asset.screenshot",
    "table_name": "resource_asset_screenshot"
  },
  {
    "count": 0,
    "detail_schema_key": "asset.video",
    "family": "asset",
    "icon_key": "image",
    "id": "asset.video",
    "label": "Video asset",
    "populated": false,
    "resource_type": "asset.video",
    "table_name": "resource_asset_video"
  },
  {
    "count": 0,
    "detail_schema_key": "automation.collector",
    "family": "automation",
    "icon_key": "workflow",
    "id": "automation.collector",
    "label": "Collector",
    "populated": false,
    "resource_type": "automation.collector",
    "table_name": "resource_automation_collector"
  },
  {
    "count": 0,
    "detail_schema_key": "automation.generator",
    "family": "automation",
    "icon_key": "workflow",
    "id": "automation.generator",
    "label": "Generator",
    "populated": false,
    "resource_type": "automation.generator",
    "table_name": "resource_automation_generator"
  },
  {
    "count": 0,
    "detail_schema_key": "automation.github_action",
    "family": "automation",
    "icon_key": "workflow",
    "id": "automation.github_action",
    "label": "GitHub Action",
    "populated": false,
    "resource_type": "automation.github_action",
    "table_name": "resource_automation_github_action"
  },
  {
    "count": 0,
    "detail_schema_key": "automation.pipeline",
    "family": "automation",
    "icon_key": "workflow",
    "id": "automation.pipeline",
    "label": "Pipeline",
    "populated": false,
    "resource_type": "automation.pipeline",
    "table_name": "resource_automation_pipeline"
  },
  {
    "count": 0,
    "detail_schema_key": "automation.script",
    "family": "automation",
    "icon_key": "workflow",
    "id": "automation.script",
    "label": "Script",
    "populated": false,
    "resource_type": "automation.script",
    "table_name": "resource_automation_script"
  },
  {
    "count": 0,
    "detail_schema_key": "automation.workflow",
    "family": "automation",
    "icon_key": "workflow",
    "id": "automation.workflow",
    "label": "Workflow",
    "populated": false,
    "resource_type": "automation.workflow",
    "table_name": "resource_automation_workflow"
  },
  {
    "count": 0,
    "detail_schema_key": "collection.catalog",
    "family": "collection",
    "icon_key": "layers",
    "id": "collection.catalog",
    "label": "Catalog",
    "populated": false,
    "resource_type": "collection.catalog",
    "table_name": "resource_collection_catalog"
  },
  {
    "count": 0,
    "detail_schema_key": "collection.ecosystem",
    "family": "collection",
    "icon_key": "layers",
    "id": "collection.ecosystem",
    "label": "Ecosystem collection",
    "populated": false,
    "resource_type": "collection.ecosystem",
    "table_name": "resource_collection_ecosystem"
  },